district_name,est_child_poverty,est_total_child,est_total_pop,year,child_pov_ratio,child_adult_ratio
Cheyenne County School District RE-5,39,229,1350,2010,0.1703056768558952,0.16962962962962963
Yuma School District 1,179,977,5017,2010,0.18321392016376664,0.19473789117002194
Wray School District RD-2,103,727,3958,2010,0.14167812929848694,0.18367862556846892
Idalia School District RJ-3,12,92,502,2010,0.13043478260869565,0.18326693227091634
Liberty School District J-4,7,69,507,2010,0.10144927536231885,0.13609467455621302
Academy School District 20,1251,21743,98451,2010,0.05753575863496298,0.22085098170663578
Adams County School District 14,1910,8238,36636,2010,0.23185239135712551,0.22486079266295447
Agate School District 300,19,108,664,2010,0.17592592592592593,0.16265060240963855
Aguilar Reorganized School District 6,68,164,1166,2010,0.4146341463414634,0.14065180102915953
Akron School District R-1,68,402,2447,2010,0.1691542288557214,0.16428279525950143
Alamosa School District RE-11J,705,2419,14365,2010,0.2914427449359239,0.1683954054994779
South Conejos School District RE-10,139,363,2250,2010,0.38292011019283745,0.16133333333333333
Archuleta County School District 50-JT,372,1718,11506,2010,0.21653084982537835,0.14931340170345905
Arickaree School District R-2,20,120,628,2010,0.16666666666666666,0.1910828025477707
Arriba-Flagler School District C-20,36,160,1142,2010,0.225,0.14010507880910683
Aspen School District 1,104,1676,13026,2010,0.06205250596658711,0.12866574543221249
Ault-Highland School District RE-9,168,1094,5620,2010,0.15356489945155394,0.19466192170818505
Adams-Arapahoe School District 28J,9251,39607,207500,2010,0.23356982351604513,0.19087710843373493
Platte Canyon School District 1,141,1498,9276,2010,0.09412550066755675,0.1614920224234584
Bayfield School District R-10-JT,121,1481,8472,2010,0.08170155300472653,0.17481114258734656
Bennett School District 29-J,90,1289,6234,2010,0.06982156710628394,0.2067693294834777
Bethune School District R-5,25,119,534,2010,0.21008403361344538,0.22284644194756553
Boulder Valley School District RE-2,3182,30328,212662,2010,0.10491954629385386,0.14261127987134514
Branson Reorganized School District 82,13,34,172,2010,0.38235294117647056,0.19767441860465115
Briggsdale School District RE-10,23,119,619,2010,0.19327731092436976,0.19224555735056542
Brighton School District 27J,1594,16322,77909,2010,0.09765960053914961,0.20950082788894736
Brush School District RE-2J,222,1527,8124,2010,0.14538310412573674,0.1879615952732644
Buena Vista School District R-31,160,1008,8659,2010,0.15873015873015872,0.116410670978173
Burlington School District RE-6J,135,742,5193,2010,0.18194070080862534,0.1428846524167148
Byers School District 32J,66,517,2481,2010,0.1276595744680851,0.20838371624345023
Calhan School District RJ-1,94,634,3018,2010,0.14826498422712933,0.2100728959575878
Campo School District RE-6,5,34,254,2010,0.14705882352941177,0.13385826771653545
Cañon City School District RE-1,823,3945,27608,2010,0.20861850443599492,0.14289336424224863
Center School District 26-JT,239,693,3307,2010,0.3448773448773449,0.20955548835802842
Cheraw School District 31,36,139,746,2010,0.2589928057553957,0.1863270777479893
Cherry Creek School District 5,4695,54582,274870,2010,0.08601736836319666,0.19857387128460727
Cheyenne Mountain School District 12,264,3741,21499,2010,0.07056936647955092,0.174008093399693
Clear Creek School District RE-1,130,1137,9112,2010,0.11433597185576078,0.12478050921861282
Plateau Valley School District 50,72,397,2565,2010,0.181360201511335,0.15477582846003898
Colorado Springs School District 11,6681,35123,228901,2010,0.19021723656863024,0.15344188098785064
Montezuma-Cortez School District RE-1,843,3339,18575,2010,0.252470799640611,0.1797577388963661
Cotopaxi School District RE-3,43,290,2736,2010,0.1482758620689655,0.10599415204678363
Creede Consolidated School District 1,18,90,710,2010,0.2,0.1267605633802817
Cripple Creek-Victor School District RE-1,105,577,4825,2010,0.18197573656845753,0.11958549222797928
Crowley County School District RE-1-J,171,567,5658,2010,0.30158730158730157,0.10021208907741251
De Beque School District 49-JT,23,147,919,2010,0.1564625850340136,0.15995647442872687
Deer Trail School District 26J,28,193,901,2010,0.14507772020725387,0.2142064372918979
Del Norte School District C-7,196,688,4142,2010,0.28488372093023256,0.16610333172380493
Delta County School District 50J,1084,5117,31264,2010,0.21184287668555796,0.16367067553735926
Denver County School District 1,22978,85901,604414,2010,0.267493975623101,0.14212278339019283
Dolores School District RE-4A,97,550,3737,2010,0.17636363636363636,0.14717687985014719
Dolores County School District RE-2,47,329,2178,2010,0.14285714285714285,0.15105601469237834
Douglas County School District RE-1,2236,65857,289268,2010,0.03395235130661889,0.22766776829791058
Durango School District 9-R,687,5204,38053,2010,0.13201383551114526,0.13675662891230653
Eads School District RE-1,21,171,1104,2010,0.12280701754385964,0.15489130434782608
Eagle County School District RE 50,899,7314,43995,2010,0.12291495761553185,0.16624616433685646
Eaton School District RE-2,177,2093,9703,2010,0.08456760630673674,0.2157064825311759
Edison School District 54-JT,27,79,327,2010,0.34177215189873417,0.2415902140672783
Elbert School District 200,35,336,1558,2010,0.10416666666666667,0.21566110397946084
Elizabeth School District C-1,149,2881,14282,2010,0.05171815341895175,0.20172244783643747
Ellicott School District 22,172,954,4355,2010,0.18029350104821804,0.2190585533869116
Englewood School District 1,565,2911,25210,2010,0.19409137753349365,0.11547005156683855
Park School District R-3,121,1313,11531,2010,0.09215536938309216,0.11386696730552424
Park County School District RE-2,149,824,6986,2010,0.1808252427184466,0.11795018608645863
Falcon School District 49,1442,16636,74053,2010,0.08667949026208223,0.2246499129002201
Frenchman School District RE-3,16,175,954,2010,0.09142857142857143,0.18343815513626835
Florence School District RE-2,341,1899,16891,2010,0.17956819378620326,0.11242673613166775
Poudre School District R-1,3184,27169,185269,2010,0.11719238838381979,0.14664622791724466
Weld County School District RE-8,516,2595,12479,2010,0.19884393063583816,0.20794935491625932
Fort Morgan School District RE-3,750,3562,16976,2010,0.21055586749017405,0.20982563619227143
Fountain School District 8,1812,7595,31937,2010,0.23857801184990124,0.237811942261327
Fowler School District R-4J,88,399,2073,2010,0.22055137844611528,0.19247467438494936
Sierra Grande School District R-30,75,263,1636,2010,0.28517110266159695,0.16075794621026895
Weld County School District RE-1,211,1896,8981,2010,0.11128691983122363,0.21111234829083622
Gilpin County School District RE-1,12,313,2782,2010,0.038338658146964855,0.11250898634076203
Roaring Fork School District RE-1,777,6410,37535,2010,0.12121684867394696,0.17077394431863593
Granada School District RE-1,66,219,943,2010,0.3013698630136986,0.23223753976670203
East Grand School District 2,229,1624,11939,2010,0.14100985221674878,0.1360247926962057
Mesa County Valley School District 51,3793,23849,142920,2010,0.15904230785357876,0.16686957738595018
Garfield County School District 16,172,1182,5909,2010,0.1455160744500846,0.20003384667456423
Greeley School District 6,4942,21407,115025,2010,0.2308590647918905,0.1861073679634862
Pawnee School District RE-12,11,79,525,2010,0.13924050632911392,0.15047619047619049
Gunnison Watershed School District RE-1J,273,2000,15248,2010,0.1365,0.1311647429171039
Hanover School District 28,48,345,1663,2010,0.1391304347826087,0.2074564040889958
Harrison School District 2,4301,12513,72759,2010,0.3437225285702869,0.17197872428153219
Haxtun School District RE-2J,44,289,1479,2010,0.1522491349480969,0.19540229885057472
Hayden School District RE-1,44,510,2821,2010,0.08627450980392157,0.18078695498050337
Hinsdale County School District RE-1,17,110,817,2010,0.15454545454545454,0.1346389228886169
Hoehne Reorganized School District 3,45,289,2189,2010,0.15570934256055363,0.13202375513933304
Holly School District RE-3,101,257,1393,2010,0.39299610894941633,0.18449389806173727
Holyoke School District RE-1J,88,595,3180,2010,0.14789915966386555,0.1871069182389937
Genoa-Hugo School District C-113,53,218,1349,2010,0.24311926605504589,0.16160118606375093
Ignacio School District 11-JT,174,1008,5493,2010,0.17261904761904762,0.18350628072091754
Jefferson County School District R-1,9121,88970,538434,2010,0.10251770259638081,0.16523845076648205
Johnstown-Milliken School District RE-5J,317,3643,16644,2010,0.08701619544331594,0.21887767363614516
Julesburg School District RE-1,35,216,1525,2010,0.16203703703703703,0.14163934426229507
Karval School District RE-23,15,54,326,2010,0.2777777777777778,0.1656441717791411
Keenesburg School District RE-3J,307,2457,12715,2010,0.12494912494912495,0.19323633503735746
Platte Valley School District RE-7,137,1098,4724,2010,0.12477231329690346,0.23243014394580863
Kim Reorganized School District 88,20,55,306,2010,0.36363636363636365,0.17973856209150327
Kiowa School District C-2,45,528,2601,2010,0.08522727272727272,0.2029988465974625
Kit Carson School District R-1,20,88,480,2010,0.22727272727272727,0.18333333333333332
West Grand School District 1-JT,41,551,3037,2010,0.07441016333938294,0.18142904181758315
North Conejos School District RE-1J,234,1016,4639,2010,0.23031496062992127,0.2190127182582453
East Otero School District R-1,418,1609,8839,2010,0.2597886886264761,0.1820341667609458
La Veta School District RE-2,41,171,1299,2010,0.23976608187134502,0.13163972286374134
Lake County School District R-1,255,1260,7287,2010,0.20238095238095238,0.1729106628242075
Lamar School District RE-2,504,1800,9393,2010,0.28,0.1916320664324497
Las Animas School District RE-1,202,627,5629,2010,0.32216905901116427,0.11138745780778113
Limon School District RE-4J,80,460,3319,2010,0.17391304347826086,0.1385959626393492
Littleton School District 6,1450,15459,92356,2010,0.09379649395174332,0.1673849019013383
Lone Star School District 101,7,52,254,2010,0.1346153846153846,0.2047244094488189
St. Vrain Valley School District RE 1J,3375,29671,152450,2010,0.11374743015065215,0.19462774680223024
Thompson School District R-2J,1824,18194,104587,2010,0.10025283060349566,0.17396043485328005
Mancos School District RE-6,91,486,3227,2010,0.18724279835390947,0.15060427641772545
Manitou Springs School District 14,129,1154,8286,2010,0.11178509532062392,0.13927105961863384
Manzanola School District 3J,60,200,920,2010,0.3,0.21739130434782608
Mapleton School District 1,1069,6160,30589,2010,0.17353896103896105,0.201379580895093
McClave School District RE-2,28,154,733,2010,0.18181818181818182,0.2100954979536153
Meeker School District RE1,62,681,3832,2010,0.09104258443465492,0.17771398747390396
Buffalo School District RE-4,28,191,1000,2010,0.14659685863874344,0.191
Miami-Yoder School District 60-JT,126,428,2210,2010,0.29439252336448596,0.19366515837104073
Moffat Consolidated School District 2,67,183,1576,2010,0.366120218579235,0.11611675126903553
Moffat County School District RE-1,341,2661,13818,2010,0.12814731304021046,0.19257490230134608
Monte Vista School District C-8,344,1269,6484,2010,0.2710795902285264,0.19571252313386797
Montrose County School District RE-1J,1423,7025,38637,2010,0.20256227758007117,0.1818205347206046
Lewis-Palmer School District 38,386,6687,28982,2010,0.05772394197697024,0.2307294182596094
West End School District RE-2,55,377,2118,2010,0.14588859416445624,0.17799811142587346
Norwood School District R-2J,52,299,1983,2010,0.17391304347826086,0.1507816439737771
South Routt School District RE-3,22,511,3156,2010,0.043052837573385516,0.16191381495564006
Otis School District R-3,22,145,874,2010,0.15172413793103448,0.16590389016018306
Ouray School District R-1,42,266,1701,2010,0.15789473684210525,0.15637860082304528
Platte Valley School District RE-3,34,122,828,2010,0.2786885245901639,0.1473429951690821
Plateau School District RE-5,10,102,533,2010,0.09803921568627451,0.19136960600375236
Peyton School District 23-JT,186,888,4063,2010,0.20945945945945946,0.21855771597341866
Pritchett School District RE-3,14,50,304,2010,0.28,0.16447368421052633
Pueblo City School District 60,5319,18583,108830,2010,0.2862293494053705,0.1707525498483874
Pueblo County School District 70,1361,9815,50362,2010,0.13866530820173203,0.19488900361383582
Rangely School District RE-4,52,442,2781,2010,0.11764705882352941,0.15893563466379002
Ridgway School District R-2,39,317,2401,2010,0.12302839116719243,0.1320283215326947
Garfield School District RE-2,515,5194,24898,2010,0.09915286869464766,0.20861113342437143
Rocky Ford School District R-2,329,986,5507,2010,0.33367139959432046,0.17904485200653714
Mountain Valley School District RE-1,51,163,1369,2010,0.3128834355828221,0.11906501095690285
Salida School District R-32,224,1219,9292,2010,0.1837571780147662,0.1311881188118812
Centennial School District R-1,112,290,1892,2010,0.38620689655172413,0.15327695560253699
Sanford School District 6J,57,305,1371,2010,0.18688524590163935,0.2224653537563822
Sangre de Cristo School District RE-22J,67,267,1234,2010,0.250936329588015,0.21636952998379255
Sargent School District RE-33J,49,217,1049,2010,0.22580645161290322,0.20686367969494757
Widefield School District 3,1465,9647,46279,2010,0.15186068207732975,0.20845307806996694
Hi-Plains School District R-23,29,90,570,2010,0.32222222222222224,0.15789473684210525
Sheridan School District 2,403,1439,8071,2010,0.28005559416261294,0.1782926527072234
Silverton School District 1,21,96,710,2010,0.21875,0.1352112676056338
Big Sandy School District 100J,56,366,1852,2010,0.15300546448087432,0.1976241900647948
Springfield School District RE-4,88,311,2002,2010,0.2829581993569132,0.15534465534465536
Steamboat Springs School District RE-2,263,2578,17406,2010,0.10201706749418153,0.14810984717913364
Valley School District RE-1,534,2888,20270,2010,0.18490304709141275,0.14247656635421804
Prairie School District RE-11,22,77,395,2010,0.2857142857142857,0.1949367088607595
Strasburg School District 31J,64,1082,4820,2010,0.059149722735674676,0.22448132780082988
Stratton School District R-4,38,229,1126,2010,0.16593886462882096,0.2033747779751332
Summit School District RE-1,385,3363,27939,2010,0.11448111804936069,0.12036937614087834
Swink School District 33,43,253,1244,2010,0.16996047430830039,0.20337620578778134
Telluride School District R-1,96,788,5865,2010,0.1218274111675127,0.13435635123614664
Northglenn-Thornton School District 12,4446,41735,210785,2010,0.10652929196118366,0.19799796000664183
Plainview School District RE-2,17,74,295,2010,0.22972972972972974,0.25084745762711863
Trinidad School District 1,382,1687,10441,2010,0.22643746295198577,0.16157456182358013
Vilas School District RE-5,10,45,239,2010,0.2222222222222222,0.18828451882845187
North Park School District R-1,49,199,1390,2010,0.24623115577889448,0.14316546762589927
Huerfano School District RE-1,240,744,5368,2010,0.3225806451612903,0.13859910581222057
Walsh School District RE-1,24,160,996,2010,0.15,0.1606425702811245
Weldon Valley School District RE-20J,13,160,871,2010,0.08125,0.18369690011481057
Custer County School District C-1,132,544,3930,2010,0.2426470588235294,0.13842239185750635
Westminster School District 50,2845,12742,70626,2010,0.22327735049442787,0.18041514456432475
Primero Reorganized School District 2,16,125,1147,2010,0.128,0.10897994768962511
Wiggins School District RE-50J,66,533,2526,2010,0.12382739212007504,0.2110055423594616
Wiley School District RE-13-JT,39,193,965,2010,0.20207253886010362,0.2
Windsor School District RE-4,353,4595,21633,2010,0.07682263329706203,0.21240697083159987
Woodland Park School District RE-2,351,3124,18629,2010,0.11235595390524968,0.1676955284771056
Woodlin School District R-104,24,90,398,2010,0.26666666666666666,0.22613065326633167
Cheyenne County School District RE-5,47,243,1383,2011,0.1934156378600823,0.175704989154013
Yuma School District 1,203,988,5046,2011,0.2054655870445344,0.19579865239793895
Wray School District RD-2,123,736,3980,2011,0.1671195652173913,0.1849246231155779
Idalia School District RJ-3,14,93,505,2011,0.15053763440860216,0.18415841584158416
Liberty School District J-4,7,70,509,2011,0.1,0.137524557956778
Academy School District 20,1279,21821,100026,2011,0.05861326245359974,0.21815328014716173
Adams County School District 14,2629,8419,37274,2011,0.31226986577978383,0.22586789719375436
Agate School District 300,15,105,666,2011,0.14285714285714285,0.15765765765765766
Aguilar Reorganized School District 6,51,157,1136,2011,0.3248407643312102,0.1382042253521127
Akron School District R-1,64,378,2431,2011,0.1693121693121693,0.15549156725627314
Alamosa School District RE-11J,711,2338,14564,2011,0.3041060735671514,0.16053282065366659
South Conejos School District RE-10,123,370,2251,2011,0.3324324324324324,0.16437139049311417
Archuleta County School District 50-JT,400,1659,11458,2011,0.24110910186859555,0.14478966660848316
Arickaree School District R-2,15,112,623,2011,0.13392857142857142,0.1797752808988764
Arriba-Flagler School District C-20,45,159,1127,2011,0.2830188679245283,0.14108251996450755
Aspen School District 1,104,1646,12980,2011,0.06318347509113001,0.1268104776579353
Ault-Highland School District RE-9,140,1107,5716,2011,0.12646793134598014,0.19366689993002098
Adams-Arapahoe School District 28J,10363,39893,211048,2011,0.25976988444087934,0.18902335013835714
Platte Canyon School District 1,136,1419,9177,2011,0.09584214235377025,0.15462569467146126
Bayfield School District R-10-JT,125,1455,8552,2011,0.0859106529209622,0.1701356407857811
Bennett School District 29-J,176,1308,6342,2011,0.1345565749235474,0.20624408703878902
Bethune School District R-5,34,123,526,2011,0.2764227642276423,0.2338403041825095
Boulder Valley School District RE-2,2980,30171,215833,2011,0.09877034238175732,0.13978863287819748
Branson Reorganized School District 82,10,32,168,2011,0.3125,0.19047619047619047
Briggsdale School District RE-10,16,120,629,2011,0.13333333333333333,0.1907790143084261
Brighton School District 27J,2037,16677,79266,2011,0.1221442705522576,0.21039285443948225
Brush School District RE-2J,240,1518,8118,2011,0.15810276679841898,0.18699186991869918
Buena Vista School District R-31,153,984,8719,2011,0.15548780487804878,0.11285697901135451
Burlington School District RE-6J,148,762,5109,2011,0.1942257217847769,0.1491485613623018
Byers School District 32J,91,520,2524,2011,0.175,0.20602218700475436
Calhan School District RJ-1,88,635,3065,2011,0.13858267716535433,0.20717781402936378
Campo School District RE-6,6,33,254,2011,0.18181818181818182,0.12992125984251968
Cañon City School District RE-1,882,3937,27908,2011,0.22402844805689612,0.14107066074243946
Center School District 26-JT,260,663,3353,2011,0.39215686274509803,0.19773337309871758
Cheraw School District 31,34,136,746,2011,0.25,0.18230563002680966
Cherry Creek School District 5,5047,54786,279686,2011,0.0921220749826598,0.19588395557875618
Cheyenne Mountain School District 12,225,3754,21843,2011,0.05993606819392648,0.17186283935356864
Clear Creek School District RE-1,136,1086,9012,2011,0.1252302025782689,0.12050599201065246
Plateau Valley School District 50,80,398,2578,2011,0.20100502512562815,0.15438324282389448
Colorado Springs School District 11,6918,35248,232563,2011,0.19626645483431684,0.15156323232844435
Montezuma-Cortez School District RE-1,821,3214,18506,2011,0.25544492843808336,0.17367340322057712
Cotopaxi School District RE-3,49,289,2766,2011,0.1695501730103806,0.10448300795372378
Creede Consolidated School District 1,13,77,708,2011,0.16883116883116883,0.10875706214689265
Cripple Creek-Victor School District RE-1,85,569,4805,2011,0.14938488576449913,0.11841831425598336
Crowley County School District RE-1-J,188,524,5559,2011,0.35877862595419846,0.09426155783414283
De Beque School District 49-JT,24,147,923,2011,0.16326530612244897,0.15926327193932827
Deer Trail School District 26J,20,193,916,2011,0.10362694300518134,0.21069868995633187
Del Norte School District C-7,169,671,4123,2011,0.2518628912071535,0.16274557361144798
Delta County School District 50J,1061,5001,30829,2011,0.21215756848630274,0.1622173927146518
Denver County School District 1,21750,88725,619968,2011,0.2451394759087067,0.14311222514710437
Dolores School District RE-4A,100,529,3722,2011,0.1890359168241966,0.14212788823213326
Dolores County School District RE-2,52,337,2174,2011,0.1543026706231454,0.15501379944802207
Douglas County School District RE-1,2678,66570,294436,2011,0.0402283310800661,0.22609327663736772
Durango School District 9-R,732,5116,38417,2011,0.14308053166536355,0.13317021110445895
Eads School District RE-1,21,168,1131,2011,0.125,0.14854111405835543
Eagle County School District RE 50,1076,7341,43765,2011,0.14657403623484538,0.16773677596252715
Eaton School District RE-2,277,2117,9870,2011,0.13084553613604158,0.21448834853090173
Edison School District 54-JT,22,79,331,2011,0.27848101265822783,0.23867069486404835
Elbert School District 200,31,328,1560,2011,0.09451219512195122,0.21025641025641026
Elizabeth School District C-1,274,2816,14302,2011,0.09730113636363637,0.1968955390854426
Ellicott School District 22,174,957,4425,2011,0.18181818181818182,0.21627118644067797
Englewood School District 1,584,2921,25640,2011,0.1999315302978432,0.1139235569422777
Park School District R-3,100,1312,11717,2011,0.07621951219512195,0.1119740547921823
Park County School District RE-2,166,781,6912,2011,0.21254801536491677,0.11299189814814815
Falcon School District 49,1565,16695,75238,2011,0.09374064091045223,0.22189585050107657
Frenchman School District RE-3,18,171,949,2011,0.10526315789473684,0.18018967334035826
Florence School District RE-2,407,1892,17068,2011,0.21511627906976744,0.1108507147879072
Poudre School District R-1,3361,27149,188281,2011,0.12379829827986298,0.1441940503821416
Weld County School District RE-8,479,2624,12695,2011,0.18254573170731708,0.20669554942890903
Fort Morgan School District RE-3,752,3545,16966,2011,0.21212976022566996,0.2089473063774608
Fountain School District 8,1816,7622,32448,2011,0.23825767515087903,0.23489891518737674
Fowler School District R-4J,85,390,2073,2011,0.21794871794871795,0.18813314037626627
Sierra Grande School District R-30,79,273,1698,2011,0.2893772893772894,0.1607773851590106
Weld County School District RE-1,231,1917,9135,2011,0.12050078247261346,0.20985221674876847
Gilpin County School District RE-1,18,317,2776,2011,0.056782334384858045,0.11419308357348704
Roaring Fork School District RE-1,836,6414,37537,2011,0.13033988150919862,0.1708714068785465
Granada School District RE-1,55,223,943,2011,0.24663677130044842,0.23647932131495228
East Grand School District 2,266,1593,11739,2011,0.1669805398618958,0.13570150779453105
Mesa County Valley School District 51,3559,23912,143673,2011,0.1488374038139846,0.1664334982912586
Garfield County School District 16,246,1185,5922,2011,0.20759493670886076,0.2001013171225937
Greeley School District 6,5103,21640,117001,2011,0.23581330868761552,0.1849556841394518
Pawnee School District RE-12,14,80,534,2011,0.175,0.149812734082397
Gunnison Watershed School District RE-1J,304,1999,15348,2011,0.1520760380190095,0.13024498305968205
Hanover School District 28,64,346,1690,2011,0.18497109826589594,0.20473372781065088
Harrison School District 2,4090,12557,73924,2011,0.32571474078203394,0.16986364374222174
Haxtun School District RE-2J,43,272,1457,2011,0.15808823529411764,0.18668496911461907
Hayden School District RE-1,80,491,2796,2011,0.1629327902240326,0.1756080114449213
Hinsdale County School District RE-1,27,112,800,2011,0.24107142857142858,0.14
Hoehne Reorganized School District 3,39,276,2134,2011,0.14130434782608695,0.12933458294283037
Holly School District RE-3,83,261,1394,2011,0.31800766283524906,0.1872309899569584
Holyoke School District RE-1J,87,561,3129,2011,0.15508021390374332,0.17929050814956854
Genoa-Hugo School District C-113,37,204,1345,2011,0.18137254901960784,0.1516728624535316
Ignacio School District 11-JT,189,985,5533,2011,0.1918781725888325,0.17802277245617207
Jefferson County School District R-1,9658,88209,542833,2011,0.1094899613418132,0.1624974900199509
Johnstown-Milliken School District RE-5J,338,3683,16930,2011,0.09177301113222916,0.21754282339043118
Julesburg School District RE-1,38,212,1520,2011,0.1792452830188679,0.1394736842105263
Karval School District RE-23,14,50,325,2011,0.28,0.15384615384615385
Keenesburg School District RE-3J,271,2485,12934,2011,0.1090543259557344,0.19212927168702645
Platte Valley School District RE-7,151,1111,4804,2011,0.13591359135913592,0.23126561199000834
Kim Reorganized School District 88,14,52,299,2011,0.2692307692307692,0.17391304347826086
Kiowa School District C-2,40,515,2605,2011,0.07766990291262135,0.19769673704414586
Kit Carson School District R-1,23,93,493,2011,0.24731182795698925,0.18864097363083165
West Grand School District 1-JT,31,541,2989,2011,0.05730129390018484,0.18099698895951824
North Conejos School District RE-1J,247,1033,4640,2011,0.23910939012584706,0.22262931034482758
East Otero School District R-1,486,1575,8845,2011,0.30857142857142855,0.17806670435274166
La Veta School District RE-2,32,153,1271,2011,0.20915032679738563,0.12037765538945712
Lake County School District R-1,329,1299,7427,2011,0.25327174749807546,0.1749023831964454
Lamar School District RE-2,476,1826,9395,2011,0.2606790799561884,0.19435870143693454
Las Animas School District RE-1,198,591,5404,2011,0.3350253807106599,0.10936343449296818
Limon School District RE-4J,81,434,3313,2011,0.18663594470046083,0.13099909447630545
Littleton School District 6,1573,15510,93928,2011,0.10141843971631205,0.16512647985691167
Lone Star School District 101,7,49,253,2011,0.14285714285714285,0.19367588932806323
St. Vrain Valley School District RE 1J,3305,29721,154754,2011,0.11120083442683625,0.19205319410160643
Thompson School District R-2J,2240,18182,106288,2011,0.12319876801231988,0.17106352551558032
Mancos School District RE-6,94,468,3214,2011,0.20085470085470086,0.14561294337274425
